<?xml version="1.0" ?>
<!--
/**
 * Magento
 *
 * NOTICE OF LICENSE
 *
 * This source file is subject to the Open Software License (OSL 3.0)
 * that is bundled with this package in the file LICENSE.txt.
 * It is also available through the world-wide-web at this URL:
 * http://opensource.org/licenses/osl-3.0.php
 * If you did not receive a copy of the license and are unable to
 * obtain it through the world-wide-web, please send an email
 * to license@magentocommerce.com so we can send you a copy immediately.
 *
 * DISCLAIMER
 *
 * Do not edit or add to this file if you wish to upgrade Magento to newer
 * versions in the future. If you wish to customize Magento for your
 * needs please refer to http://www.magentocommerce.com for more information.
 *
 * @copyright   Copyright (c) 2014 X.commerce, Inc. (http://www.magentocommerce.com)
 * @license     http://opensource.org/licenses/osl-3.0.php  Open Software License (OSL 3.0)
 */

-->
<repository xmlns:xsi="http://www.w3.org/2001/XMLSchema-instance"
            xsi:noNamespaceSchemaLocation="../../../../../../Mtf/Repository/etc/repository.xsd">
    <storage class="Magento\BlockRender\Test\Repository\BlockRender">
        <dataset name="dummy_dataset">
            <field name="dummy_simple_field" xsi:type="string">test_value</field>
            <field name="dummy_array_field" xsi:type="array">
                <item name="dummy_array_0" xsi:type="array">
                    <item name="dummy_array_0" xsi:type="array">
                        <item name="dummy_array_0" xsi:type="string">test_value_0</item>
                        <item name="dummy_array_1" xsi:type="string">test_value_1</item>
                    </item>
                    <item name="dummy_array_1" xsi:type="string">test_value_1</item>
                </item>
                <item name="dummy_array_1" xsi:type="string">test_value_1</item>
            </field>
        </dataset>
    </storage>
</repository>
